{
  "asset_id": "N1-PORTAL-ORIGINAL-001",
  "origin": "original",
  "author": "SquirmyWormy275/apple1 project",
  "license_status": "PROJECT_LICENSE_PENDING",
  "redistribution_status": "PROJECT_ORIGINAL",
  "changes": "Generated as text from the portal state model.",
  "attribution": "Original project-native text frame.",
  "published": true
}
